journal name;issue;volume;year;page number;page index;image number;caption;area in percentage;x1;y1;x2;y2;image
Volné směry;35;35;1938-00-00 1940-00-00;3;3;1;;0.02;1026;1233;1391;1601;3_1_origin.jpeg
Volné směry;35;35;1938-00-00 1940-00-00;24;24;1;VÁCLAV ANTOŠ (1878—1938);0.18;614;471;1652;1951;24_1_origin.jpeg
Volné směry;35;35;1938-00-00 1940-00-00;25;25;1;Josef Navrátii (1798-1865): Větévka se švestkami Olej;0.39;252;1561;2344;3198;25_1_origin.jpeg
Volné směry;35;35;1938-00-00 1940-00-00;25;25;2;Jdosef Navrátil (1798-1865): Smrt Žižkova;0.22;491;194;2069;1403;25_2_origin.jpeg
Volné směry;35;35;1938-00-00 1940-00-00;26;26;1;Josef Navrátil: Větévka se švestkami. (Část);0.68;104;354;2282;3080;26_1_origin.jpeg
Volné směry;35;35;1938-00-00 1940-00-00;27;27;1;Josef Navrátil: Spfcí dívka Olej, 15 x13 cm;0.64;273;351;2406;2964;27_1_origin.jpeg
Volné směry;35;35;1938-00-00 1940-00-00;28;28;1;ová scéna;0.09;1033;1781;1951;2628;28_1_origin.jpeg
Volné směry;35;35;1938-00-00 1940-00-00;29;29;1;A. Chittussi: Krajina;0.6;158;419;2187;2974;29_1_origin.jpeg
Volné směry;35;35;1938-00-00 1940-00-00;30;30;1;Josef Navrátil: Zát.ší s ovocem (Část.);0.58;240;336;2053;3125;30_1_origin.jpeg
Volné směry;35;35;1938-00-00 1940-00-00;31;31;1;Josef Ménes (1820-1871): Sv. Jiří. Návrh na prapor Sokola v Roudnici Kresba perem, 29 x 32cm;0.5;209;655;2348;2682;31_1_origin.jpeg
Volné směry;35;35;1938-00-00 1940-00-00;32;32;1;Josef Mánes: Historie o ztraceném klubíčku. Drak. Akvarelov. perokresba, 28x10 cm;0.32;1270;281;2268;3063;32_1_origin.jpeg
Volné směry;35;35;1938-00-00 1940-00-00;32;32;2;Josef Mánes: „„Vrah číhá na jinocha''. Illustrace k Rukopisu Královédvorskému. Tuš. kresba 24x 8:5 cm;0.3;219;334;1163;3059;32_2_origin.jpeg
Volné směry;35;35;1938-00-00 1940-00-00;33;33;1;Karel Purkyně (1834-1868): Podobizna paní Wiesnerové Olej, 80x107 <m;0.64;269;390;2292;3141;33_1_origin.jpeg
Volné směry;35;35;1938-00-00 1940-00-00;34;34;1;Antonín Chittussi (1847-1691): Velká krajina Olej, 128 x 147 cm;0.58;250;338;2053;3137;34_1_origin.jpeg
Volné směry;35;35;1938-00-00 1940-00-00;35;35;1;Antonín Chittussi: Po západě;0.31;214;1592;2240;2920;35_1_origin.jpeg
Volné směry;35;35;1938-00-00 1940-00-00;35;35;2;Antonín Chittussi: Francouzská krajina. Olej, 50 x 100 cm Ze sbírky M. Holého v Praze;0.23;209;316;2227;1301;35_2_origin.jpeg
Volné směry;35;35;1938-00-00 1940-00-00;36;36;1;Antonín Chittussi: Krajina z okolí St. Cloud Olej, 39x60 5 cm;0.38;871;323;2064;3117;36_1_origin.jpeg
Volné směry;35;35;1938-00-00 1940-00-00;37;37;1;Mikuláš Aleš (1852-1913): Studie Tušová kresba, 26:5 x 14 cm;0.47;583;344;2045;3125;37_1_origin.jpeg
Volné směry;35;35;1938-00-00 1940-00-00;38;38;1;|. Aleš: Náčrt k listu ,„Oheň'“ Kresba uhlem a perem, 21x32 cr;0.56;220;344;2011;3064;38_1_origin.jpeg
Volné směry;35;35;1938-00-00 1940-00-00;39;39;1;Mikuláš Aleš: Cikání Kolorovaná kresba tužkou a perem, 16:5 x51 cm;0.34;679;253;1681;3205;39_1_origin.jpeg
Volné směry;35;35;1938-00-00 1940-00-00;52;52;1;Antonin Chittussi: Les;0.39;187;1373;2198;3077;52_1_origin.jpeg
Volné směry;35;35;1938-00-00 1940-00-00;52;52;2;Antonín Chrttussi: Francouzská krajina;0.18;280;310;2091;1180;52_2_origin.jpeg
Volné směry;35;35;1938-00-00 1940-00-00;53;53;1;Antonín Slavíček (1870-1910): Pohled k Troji (1908);0.42;427;588;2081;2817;53_1_origin.jpeg
Volné směry;35;35;1938-00-00 1940-00-00;54;54;1;"František Kaván:; Podmrak. Olej, 1894 Česká Akademie";0.66;183;362;2284;3108;54_1_origin.jpeg
Volné směry;35;35;1938-00-00 1940-00-00;55;55;1;Max Švabinský: Triptych, část levá Obrazárna na Mradě;0.64;263;353;2286;3094;55_1_origin.jpeg
Volné směry;35;35;1938-00-00 1940-00-00;56;56;1;Max Švabinský: Návrh freskové výzdoby pro velkou aulu právnické fakulty v Praze Olej, 58x141 cm;0.37;660;319;1796;3127;56_1_origin.jpeg
Volné směry;35;35;1938-00-00 1940-00-00;57;57;1;Eduard Munch: Výzdoba továrny na čokoládu;0.26;261;471;2257;1593;57_1_origin.jpeg
Volné směry;35;35;1938-00-00 1940-00-00;57;57;2;Eduard Munch: Výzdoba továrny na čokoládu;0.24;280;1869;2279;2924;57_2_origin.jpeg
Volné směry;35;35;1938-00-00 1940-00-00;58;58;1;Eduard Munch: Smrt Maratova (1906);0.68;162;283;2228;3156;58_1_origin.jpeg
Volné směry;35;35;1938-00-00 1940-00-00;59;59;1;;0.31;109;418;1136;3058;59_1_origin.jpeg
Volné směry;35;35;1938-00-00 1940-00-00;59;59;2;"Eduard Munch; Matka země Universitní aula v Oslo o|SO A PJN jUJISIIAUN";0.3;1270;421;2272;3063;59_2_origin.jpeg
Volné směry;35;35;1938-00-00 1940-00-00;61;61;1;Eduard Munch: Tanec na břehu;0.42;226;294;2160;2177;61_1_origin.jpeg
Volné směry;35;35;1938-00-00 1940-00-00;62;62;1;;0.36;102;783;1501;3047;62_1_origin.jpeg
Volné směry;35;35;1938-00-00 1940-00-00;63;63;1;Bertoldo di Giovanni: Herkules na koni. Bronz, výš. 27:5 cm Ukázka z právě vydaré knihy: Emil Filla, Problém renesance a drobná plastika Museum v Moďd;0.61;194;364;2269;2903;63_1_origin.jpeg
Volné směry;35;35;1938-00-00 1940-00-00;64;64;1;Bartolomeo Bellano: Únos Evropy. Bronz, výš. 21*5 cm Ukázka z právě vydané knihy: Emil Filla, Problém renesance a drobná plastika Mus. Nazionale, Florencie;0.6;186;460;2342;2901;64_1_origin.jpeg
Volné směry;35;35;1938-00-00 1940-00-00;65;65;1;Eduard Munch ve svém atelieru;0.22;389;320;2198;1401;65_1_origin.jpeg
Volné směry;35;35;1938-00-00 1940-00-00;65;65;2;Eduard Munch;0.12;856;1851;1751;3025;65_2_origin.jpeg
Volné směry;35;35;1938-00-00 1940-00-00;66;66;1;ČESKÝ MISTR KOLEM 1370 VOTIVNÍ OBRAZ ARCIBISKUPA OČKA Z VLAŠIMĚ STATNÍ SBÍRKA STARÉHO UMĚNÍ (OBRAZÁRNAS. V PíO US V PRAZE;0.39;494;330;1839;2883;66_1_origin.jpeg
Volné směry;35;35;1938-00-00 1940-00-00;76;76;1;S V.U. Manes, Praha Foto Sudek, Praha;0.34;475;269;1928;2288;76_1_origin.jpeg
Volné směry;35;35;1938-00-00 1940-00-00;77;77;1;"V. U. Mánes. Praha. Foto Sudek, Pr :s;: Ozdobná výplň s pávem.";0.15;1054;252;1515;3017;77_1_origin.jpeg
Volné směry;35;35;1938-00-00 1940-00-00;78;78;1;;0.29;745;255;1660;2975;78_1_origin.jpeg
Volné směry;35;35;1938-00-00 1940-00-00;79;79;1;S. V, U. Mánes, Praha J. V. Myslbek: Hlava koně, detail pomníku sv. Václava Foto Sudek, Praha;0.55;438;264;2152;3050;79_1_origin.jpeg
Volné směry;35;35;1938-00-00 1940-00-00;80;80;1;S V.Uu Móánis. Praha M. Švabinský: Poleédne na horách. 1933 Foio Stenc, Fraha;0.52;271;402;2149;2793;80_1_origin.jpeg
Volné směry;35;35;1938-00-00 1940-00-00;81;81;1;S. V. U. Mánes, Praha O. Španiel: J. E. Purkyně Foto Sudek, Praha Bronz;0.64;238;270;2268;3035;81_1_origin.jpeg
Volné směry;35;35;1938-00-00 1940-00-00;82;82;1;S. V. U. Mánet, Praha V. Nechleba: Vlastní podobizna. 1938 Foto Press photo cervice, Praha;0.55;164;353;2315;2578;82_1_origin.jpeg
Volné směry;35;35;1938-00-00 1940-00-00;83;83;1;S.V. U. Mánes, Praha Ť K. Pokorný: Kresba .,;0.52;252;227;1808;3153;83_1_origin.jpeg
Volné směry;35;35;1938-00-00 1940-00-00;84;84;1;;0.62;259;360;2331;2955;84_1_origin.jpeg
Volné směry;35;35;1938-00-00 1940-00-00;85;85;1;Ť V. U. Mánes, Praha Foto Št 3. Kafka: Pomník Dra A.Zátky v Českých Budějovicích. (1935) |;0.32;711;333;1756;3006;85_1_origin.jpeg
Volné směry;35;35;1938-00-00 1940-00-00;86;86;1;S, V. U. Mánes, Praha A. Hudeček: Krajina Foto Sudek, Praha;0.58;279;282;2095;3069;86_1_origin.jpeg
Volné směry;35;35;1938-00-00 1940-00-00;87;87;1;„V.U. Mánes, Praha „Kofránek: Podobizna Dr. Ing. Fr. Křižiíka Foto Sudek, Prah;0.55;395;269;2149;3008;87_1_origin.jpeg
Volné směry;35;35;1938-00-00 1940-00-00;88;88;1;S.V.U. Mánes, Praha K. Dvořák: Podobizna K. Čapka. 1938 Foto Sudek, Praha Bronz;0.58;276;301;2117;3051;88_1_origin.jpeg
Volné směry;35;35;1938-00-00 1940-00-00;89;89;1;"S. V. U, Mánes, Praha B. Jelínková-Jirásková:;: Zimníf krajína Foto Sudek, Praha";0.67;221;233;2329;3010;89_1_origin.jpeg
Volné směry;35;35;1938-00-00 1940-00-00;90;90;1;S.V.U. Mánes, Praha Emil Filla: Bílá noc. 1938 Foto Sudek. Praha Olejová tempera;0.61;159;338;2166;2991;90_1_origin.jpeg
Volné směry;35;35;1938-00-00 1940-00-00;91;91;1;S. V. U. Mánes, Praha V. Ššpála: Pivoňky. 1938 Foto Sudek, Praha;0.56;396;266;2187;3004;91_1_origin.jpeg
Volné směry;35;35;1938-00-00 1940-00-00;96;96;1;M. Švabinský: Dvě podobizny;0.5;305;422;2150;2760;96_1_origin.jpeg
Volné směry;35;35;1938-00-00 1940-00-00;104;104;1;S. V. U. Mánes, Praha A. Procházka: Výzdoba auly brněnské university. (Část.) Foto Sudek, Praha;0.64;210;326;2230;3091;104_1_origin.jpeg
Volné směry;35;35;1938-00-00 1940-00-00;105;105;1;S.V. U. Mánes. Praha V. Sychra: Podobizna pí T. Yorkeové Foto Sudek, Fraha;0.6;265;408;2303;2964;105_1_origin.jpeg
Volné směry;35;35;1938-00-00 1940-00-00;106;106;1;Foto Sudek. Praha Olej;0.61;171;358;2231;2942;106_1_origin.jpeg
Volné směry;35;35;1938-00-00 1940-00-00;107;107;1;"S. V. U. Mánes, Praha A. Fišárek ;: Prosté zátiší. 1938 Foto Sudek, Praha Kvaš";0.59;268;402;2301;2942;107_1_origin.jpeg
Volné směry;35;35;1938-00-00 1940-00-00;108;108;1;S.V.U. Mánes, Praha Vincenc Beneš: Rybník v Dobevi u Písku. 1938 Foto Sudek. Praha Olej;0.65;126;354;2232;3022;108_1_origin.jpeg
Volné směry;35;35;1938-00-00 1940-00-00;109;109;1;S. V. U. Mánes, Praha R. Wiesner: Podobizna Věry B. Foto Sudek, ?raha;0.52;399;399;2213;2914;109_1_origin.jpeg
Volné směry;35;35;1938-00-00 1940-00-00;110;110;1;"S. V. U. Mánes, Praha J. Grus:; Les Foto Sudek. Praha";0.61;188;355;2244;2920;110_1_origin.jpeg
Volné směry;35;35;1938-00-00 1940-00-00;111;111;1;;0.55;413;327;2158;3087;111_1_origin.jpeg
Volné směry;35;35;1938-00-00 1940-00-00;112;112;1;>Ý. V. U. Mánes, Praha K. Ossendorf-R. F. Podzemný: Vila JUDr. J. Š. v Čes. Budějovicích Foto Svdek, Prahá;0.61;267;297;2163;3100;112_1_origin.jpeg
Volné směry;35;35;1938-00-00 1940-00-00;113;113;1;S.V. U. Mánes, Praha Marie Wagnerová-Kulhánková: ,„Pepíček“' Foto Sudek, Praha Patinovaná sádra;0.5;466;265;2050;3016;113_1_origin.jpeg
Volné směry;35;35;1938-00-00 1940-00-00;114;114;1;S,. V.U. Mánes. Praha J. Wagner: Země Foto Sudek, Praha Lipové dřevo;0.34;1196;303;2276;3049;114_1_origin.jpeg
Volné směry;35;35;1938-00-00 1940-00-00;114;114;2;S V.U. Mánes. Praha Břetislav Benda: Zamyšlení Foto Sudek, Praha Bronz;0.29;180;315;1099;3052;114_2_origin.jpeg
Volné směry;35;35;1938-00-00 1940-00-00;115;115;1;S.V.,U. Mánes, Praha J. Benda: Zátiší s kartami Foto Sudek, Praha;0.3;215;1674;2259;2944;115_1_origin.jpeg
Volné směry;35;35;1938-00-00 1940-00-00;115;115;2;S.V.U. Máněs. Praha F. Tichý: Karty Foto Sudek, Praha;0.26;212;341;2254;1454;115_2_origin.jpeg
Volné směry;35;35;1938-00-00 1940-00-00;116;116;1;S. V. U. Mánese, Praha Jan Kaván: Studie k podobizně. Bronz Foto Sudek, Praha;0.31;167;1686;2215;2991;116_1_origin.jpeg
Volné směry;35;35;1938-00-00 1940-00-00;116;116;2;S., V, U. Mánes, Praha Z. Schwarzerová: Loďaři. Foto Sudek,Praha;0.28;271;360;2211;1604;116_2_origin.jpeg
Volné směry;35;35;1938-00-00 1940-00-00;117;117;1;"S. V. U. Mánes, Praha R. Vejrych; Litomyšl Foto Sudek. Fraha";0.4;252;1452;2285;3164;117_1_origin.jpeg
Volné směry;35;35;1938-00-00 1940-00-00;117;117;2;"S. V. U. Mánes, Praha R. Vejrych; Litomyšl Foto Sudek. Fraha";0.24;252;203;2281;1239;117_2_origin.jpeg
Volné směry;35;35;1938-00-00 1940-00-00;118;118;1;S.V. U. Mánes. Praha V. Markup: Bakchanale (1938) Foto Sudek, Praha Mušlový vápenec R _„____„„———_.————q——;0.37;193;1629;2237;3203;118_1_origin.jpeg
Volné směry;35;35;1938-00-00 1940-00-00;118;118;2;;0.31;190;126;2224;1434;118_2_origin.jpeg
Volné směry;35;35;1938-00-00 1940-00-00;119;119;1;;0.32;307;1688;2224;3135;119_1_origin.jpeg
Volné směry;35;35;1938-00-00 1940-00-00;119;119;2;>, V. U. Mánes, Praha JÍ Lada: Jaro Foto Sudek, Prah Akvare;0.28;254;268;2264;1467;119_2_origin.jpeg
Volné směry;35;35;1938-00-00 1940-00-00;120;120;1;S. V. U. Mánes, Prana J. Bauch : Poslední cesta Foto Sudeak, Praha Olej;0.62;245;290;2182;3092;120_1_origin.jpeg
Volné směry;35;35;1938-00-00 1940-00-00;121;121;1;S.V, U. Mános, Praha H. Dostálová: Krajina Foto Sudek, Praha;0.36;267;1743;2297;3268;121_1_origin.jpeg
Volné směry;35;35;1938-00-00 1940-00-00;121;121;2;;0.34;267;99;2291;1565;121_2_origin.jpeg
Volné směry;35;35;1938-00-00 1940-00-00;122;122;1;S. V. U. Mánes, Praha V. Vokálek: Podobizna. 1938 Foto Sudek, Praha Bronz;0.35;190;1667;1958;3393;122_1_origin.jpeg
Volné směry;35;35;1938-00-00 1940-00-00;122;122;2;S. V. U. Mánsa, Praha J. Král: Žena v krajíně. 1937 Foto Sudek, Praha;0.31;184;124;2035;1579;122_2_origin.jpeg
Volné směry;35;35;1938-00-00 1940-00-00;123;123;1;S. V. U. Mánes, Praha 8. Žufan: V zahradě Foto Sudek, Praha;0.56;195;458;2264;2810;123_1_origin.jpeg
Volné směry;35;35;1938-00-00 1940-00-00;124;124;1;%. V. U. Mánes, Praha F. M. Černý: Vila na Hanspaulce v Praze. 1938 Foto Sudek, Praha;0.59;233;300;2132;3000;124_1_origin.jpeg
Volné směry;35;35;1938-00-00 1940-00-00;125;125;1;S. V.U. Mánes, Praha Vlad. Kristin : Zátiší ze suchých slunečnic Foto Sudek, Praha Olej;0.33;537;555;2055;2469;125_1_origin.jpeg
Volné směry;35;35;1938-00-00 1940-00-00;126;126;1;S.V. U. Mánes. Praha Koně. Část pompejské fresky Foto Sudek, Praha Neapol. Mus. Nazionale;0.45;162;621;2262;2477;126_1_origin.jpeg
Volné směry;35;35;1938-00-00 1940-00-00;127;127;1;;0.6;351;297;2204;3118;127_1_origin.jpeg
Volné směry;35;35;1938-00-00 1940-00-00;128;128;1;;0.69;200;284;2328;3098;128_1_origin.jpeg
Volné směry;35;35;1938-00-00 1940-00-00;129;129;1;;0.69;151;272;2271;3106;129_1_origin.jpeg
Volné směry;35;35;1938-00-00 1940-00-00;130;130;1;S. V. U. Mánes, Praha exu 394 klášterní knihovny v Rajhradě Foto Sudek, Praha;0.29;284;300;2127;1652;130_1_origin.jpeg
Volné směry;35;35;1938-00-00 1940-00-00;130;130;2;S.V. U. Mánes. Praha Foto Sudek, Pr Český m. kolem 1370: Sv. Kryštof a Madona s Ježíškem. Miniatury;0.25;311;1771;2147;2948;130_2_origin.jpeg
Volné směry;35;35;1938-00-00 1940-00-00;131;131;1;S. V, U., Mánes, Praha Český m. po 1380: Ukřížování, Misál č. 10 kcstela sv. Jakuba v Brně Foto Sudek, |;0.61;215;270;2145;3025;131_1_origin.jpeg
Volné směry;35;35;1938-00-00 1940-00-00;132;132;1;;0.62;254;275;2202;3049;132_1_origin.jpeg
Volné směry;35;35;1938-00-00 1940-00-00;133;133;1;;0.74;151;202;2338;3128;133_1_origin.jpeg
Volné směry;35;35;1938-00-00 1940-00-00;134;134;1;S.V. U. Mánes, Praha Francie: Románský relief z 12. stol. Louvre Foto Sudek, Pr.;0.57;136;288;2185;2705;134_1_origin.jpeg
Volné směry;35;35;1938-00-00 1940-00-00;135;135;1;S.V. U. Mánes, Prana instalace výstavy: „Postavy českých dějin'', V Máncsu 1938 Foto Sudek, Praha;0.26;278;261;2322;1375;135_1_origin.jpeg
Volné směry;35;35;1938-00-00 1940-00-00;135;135;2;S.V.U. Mánes, Praha Instalace výstavy: „Česká tradice v 19. stol.'“ V Mánesu 1939 Foto Sudek, Praha;0.25;289;1898;2326;2958;135_2_origin.jpeg
Volné směry;35;35;1938-00-00 1940-00-00;136;136;1;Rembrandi: W lastní podobízna. Museum v Kolíně n R. 820 63 cm. Část.;0.6;214;285;2146;2979;136_1_origin.jpeg
Volné směry;35;35;1938-00-00 1940-00-00;138;138;1;"Josef Mánes Řípsk_\"" kraj. olej";0.5;324;305;1993;2938;138_1_origin.jpeg
Volné směry;35;35;1938-00-00 1940-00-00;148;148;1;Mánes Mánes: Studie aktu k Vzpomínkám. Kresba Foto archiv Volných Směrů;0.3;600;405;1897;2409;148_1_origin.jpeg
Volné směry;35;35;1938-00-00 1940-00-00;149;149;1;;0.15;517;1816;1733;2896;149_1_origin.jpeg
Volné směry;35;35;1938-00-00 1940-00-00;150;150;1;Foto archi;0.22;299;480;2082;1531;150_1_origin.jpeg
Volné směry;35;35;1938-00-00 1940-00-00;150;150;2;S.V. U. Mánes Josef Mánes: Alžběta Langová z Jihlavy. Kolorovaná kresba;0.26;351;1859;2159;3125;150_2_origin.jpeg
Volné směry;35;35;1938-00-00 1940-00-00;151;151;1;S. V. U. Mánes Josef Mánes: Narození Paně. Lavírovaná perokresba Foto archiv Volných Směrů;0.24;554;272;2000;1716;151_1_origin.jpeg
Volné směry;35;35;1938-00-00 1940-00-00;151;151;2;S. V. U. Mánes Josef Mánes: Život na panském sídle: Tanec Foto archiv Volných Směr;0.17;186;2189;2319;2881;151_2_origin.jpeg
Volné směry;35;35;1938-00-00 1940-00-00;152;152;1;S. V. U. Mánes Joasef Mánes: Orloj: Květen. Olej na mědi Foto archiv Volných Směrů;0.39;215;145;2036;1999;152_1_origin.jpeg
Volné směry;35;35;1938-00-00 1940-00-00;152;152;2;S.V.U Mánes Josef Mánes: Život na panském sldle: Hudba Foto archiv Volných Směrů;0.18;73;2186;2239;2897;152_2_origin.jpeg
Volné směry;35;35;1938-00-00 1940-00-00;153;153;1;;0.3;313;1816;2229;3185;153_1_origin.jpeg
Volné směry;35;35;1938-00-00 1940-00-00;153;153;2;S. V. U. Mánes Josef Mánes: Rukopisy: Růže. Perokresba na tužkovém náčrtku tuší lavlrovaná;0.3;328;254;2181;1685;153_2_origin.jpeg
Volné směry;35;35;1938-00-00 1940-00-00;154;154;1;S. V. U. Mánes Český mistr k polovině 15. stol.: Ukřižování. Dřevoryt Foto archiv Volných Směrů Třeboň, Městské museum;0.58;282;232;2177;2909;154_1_origin.jpeg
Volné směry;35;35;1938-00-00 1940-00-00;155;155;1;S.V. U. Mánes Korunování trním. Nástěnná malba v Křeči Foto arcniv volných Směrů;0.57;356;254;2214;2926;155_1_origin.jpeg
Volné směry;35;35;1938-00-00 1940-00-00;156;156;1;S. V. U. Mánes Nesení kříže. Nástěnná malba v Křeči Foto archiv Volných Směrů;0.59;231;321;2156;2991;156_1_origin.jpeg
Volné směry;35;35;1938-00-00 1940-00-00;157;157;1;Bičování Krista. Nástěnné malby v Křeči Foto archiv Volných Směrů;0.25;463;1769;2189;3046;157_1_origin.jpeg
Volné směry;35;35;1938-00-00 1940-00-00;157;157;2;S. V. U. Mánes Kristus před Pilátem;0.25;459;429;2184;1673;157_2_origin.jpeg
Volné směry;35;35;1938-00-00 1940-00-00;158;158;1;S. V. U. Mánes Ant. Kalvoda: Podobizna Ludmily Baťové Foto archiv Volných Směrů;0.58;271;240;2160;2910;158_1_origin.jpeg
Volné směry;35;35;1938-00-00 1940-00-00;159;159;1;S$.V:U. Mánes Petr Brueguel: Dětské hry (1560) Foto archiv Volných Směrů Vídeň (Wien), Kunsthistorisches Museum;0.57;252;391;2142;3031;159_1_origin.jpeg
Volné směry;35;35;1938-00-00 1940-00-00;160;160;1;S.V. U. Mánes Petr Brueguel: Nizozemská přísloví Foto archiv Volných Směrů Berlin, Deutsches Museum;0.59;224;383;2152;3066;160_1_origin.jpeg
Volné směry;35;35;1938-00-00 1940-00-00;161;161;1;S.V. U. Mánes Petr Brueguel: Včelaři. Kresba perem Foto archiv Volných Směru Berlin, Kupferstichkabinett;0.29;359;1651;2301;2940;161_1_origin.jpeg
Volné směry;35;35;1938-00-00 1940-00-00;161;161;2;;0.27;352;196;2287;1409;161_2_origin.jpeg
Volné směry;35;35;1938-00-00 1940-00-00;162;162;1;S8.V.U. Mánes Petr Brueguel: Prchající pastýř Foto archiv Volných Směrů Philadelphia, sbírka A. Johnsona;0.59;189;330;2121;2987;162_1_origin.jpeg
Volné směry;35;35;1938-00-00 1940-00-00;163;163;1;S.V.U. Mánes Josef Navrátil: Klečící. Olej Foto archiv Volných Směrů Soukromá sbírka v Praze;0.52;458;365;2131;3045;163_1_origin.jpeg
Volné směry;35;35;1938-00-00 1940-00-00;172;172;1;Chittussi: Údolí Jihlavky u Petrovic na Moravě (1887) m = —;0.63;194;320;2287;2951;172_1_origin.jpeg
Volné směry;35;35;1938-00-00 1940-00-00;174;174;1;S. V. U. Mánes Antonín Chittussi: Partie ze Lhůt u Ronova. Olej Foto archiv Volných Směrů Soukromá sbírka v Praze;0.34;137;402;2127;1884;174_1_origin.jpeg
Volné směry;35;35;1938-00-00 1940-00-00;174;174;2;S. V. U. Mánes Mikoláš Aleš: Dušičky. Kresba Foto archiv Volných Směrů $oukromá sbírka v Praze;0.18;135;2141;2130;2916;174_2_origin.jpeg
Volné směry;35;35;1938-00-00 1940-00-00;175;175;1;S. V. U. Mánes Antonín Chittussi: Holandská studie. Olej Foto archiv Volných Směrů Soukromá sbírka v Praze;0.6;273;385;2212;3065;175_1_origin.jpeg
Volné směry;35;35;1938-00-00 1940-00-00;176;176;1;S.V.U. Mánes Antonín Slavíček: Pražák u Vodňan (3. 9. 1908). Olej Foto archiv Volných Směrů Soukromá sbírka v Praze;0.54;248;357;2017;3023;176_1_origin.jpeg
Volné směry;35;35;1938-00-00 1940-00-00;177;177;1;S.V. U. Mánes V. Antoš: Zasněžené chalupy. Olej Foto archiv Volných Směrů;0.58;356;285;2273;2899;177_1_origin.jpeg
Volné směry;35;35;1938-00-00 1940-00-00;178;178;1;S.V. U. Mánes V. Antoš: Mladý hsch (Hoch Makovec). Sádra 1912. Foto archiv Volných Směrů Moderní galerie v Praze;0.61;175;237;2150;2931;178_1_origin.jpeg
Volné směry;35;35;1938-00-00 1940-00-00;179;179;1;S.V.U. Mánes Foto archiv Volných Směrů Karel Pokorný: Křest sv. Ludmily. Do chrámu sv. Víta věnoval ministr školství a nár. osvěty prof. Dr. Jan Kapras;0.54;301;477;2226;2902;179_1_origin.jpeg
Volné směry;35;35;1938-00-00 1940-00-00;180;180;1;S. V. U. Mánes Karel Pokorný: Studie ke Kristu (1939) Foto archiv Volných Směrů;0.58;247;292;2147;2968;180_1_origin.jpeg
Volné směry;35;35;1938-00-00 1940-00-00;181;181;1;;0.57;263;352;2143;3004;181_1_origin.jpeg
Volné směry;35;35;1938-00-00 1940-00-00;182;182;1;S. V, U. Mánes V. Beneš: Jihočeská silnice Foto archiv Volných Směrů;0.57;205;398;2177;2892;182_1_origin.jpeg
Volné směry;35;35;1938-00-00 1940-00-00;183;183;1;S. V. U. Manes Vladimír Sychra: Zátiší Foto archiv Volných Směru;0.44;645;314;2091;2970;183_1_origin.jpeg
Volné směry;35;35;1938-00-00 1940-00-00;184;184;1;"S.V.U. Máneas Vladim(ír Sychra:; Podobizna slečny M. Foto archiv Volných Směrů";0.61;237;299;2208;2977;184_1_origin.jpeg
Volné směry;35;35;1938-00-00 1940-00-00;185;185;1;S.V.U. Mánes A. Fišárek : Kytice Foto archiv Volných Směřů;0.56;258;416;2216;2897;185_1_origin.jpeg
Volné směry;35;35;1938-00-00 1940-00-00;186;186;1;$. V. U. Mánes A. Fišárek : Zátiší Foto archiv Volných Směrů;0.6;257;339;2227;3010;186_1_origin.jpeg
Volné směry;35;35;1938-00-00 1940-00-00;187;187;1;S.V.U. Mánes Josef Wagner: Podobizna M. K. W. Pálená hlína Foto archiv Volných Směrů;0.57;333;348;2258;2925;187_1_origin.jpeg
Volné směry;35;35;1938-00-00 1940-00-00;188;188;1;S.V.U. Mánes Josef Wagner: Oblaka. Tvrdý pískovec Foto archiv Volných Směrů;0.58;249;269;2127;2955;188_1_origin.jpeg
Volné směry;35;35;1938-00-00 1940-00-00;189;189;1;S. V. U. Mánes Foto archiv Volných Směrů V. Makovský: Soutěžný návrh na výzdobu Národního divadla v Brně. Bronz;0.48;533;205;2069;2908;189_1_origin.jpeg
Volné směry;35;35;1938-00-00 1940-00-00;193;193;1;"8. V. U. Mánce Josef Mánes;: Poměnky. Litografie 1850 Fete arehiv Volných Směrů";0.29;608;1116;1985;2953;193_1_origin.jpeg
Volné směry;35;35;1938-00-00 1940-00-00;194;194;1;;0.58;195;294;2078;2979;194_1_origin.jpeg
Volné směry;35;35;1938-00-00 1940-00-00;196;196;1;"S. V, U. Mánes R. F. Podzemný:; Obytný dům Zemské banky v Praze XIX Durychovo nám. Foto archiv Volných Směrů";0.61;193;311;2084;3113;196_1_origin.jpeg
Volné směry;35;35;1938-00-00 1940-00-00;197;197;1;$. V. U. Mánes R. F. Podzemný: Obytný dům Zemské banky v Praze X1X. Foto archiv Volných Směrů;0.57;256;276;2250;2767;197_1_origin.jpeg
Volné směry;35;35;1938-00-00 1940-00-00;198;198;1;S. V. U, Mánes R. F. Podzemný: Interieur obytného domu Zemské banky v Praze X1IX. Foto archiv Volných Směrů;0.3;253;1661;2134;3067;198_1_origin.jpeg
Volné směry;35;35;1938-00-00 1940-00-00;198;198;2;S. V. U, Mánes R. F. Podzemný: Interieur obytného domu Zemské banky v Praze X1IX. Foto archiv Volných Směrů;0.27;251;331;2112;1574;198_2_origin.jpeg
Volné směry;35;35;1938-00-00 1940-00-00;199;199;1;m—————-—————————————?_f_—_—_ S.V.U. Manes J. Lauda: Terakota v hale obytného domu Zemské banky v Praze XIX. Foto archiv Volných Směrů;0.22;616;288;1293;3081;199_1_origin.jpeg
Volné směry;35;35;1938-00-00 1940-00-00;199;199;2;m—————-—————————————?_f_—_—_ V. U. Manes : Lauda: Terakota v hale obytného domu Zemské banky v Praze X1IX. Foto archiv Volných Směrů;0.2;1468;327;2080;3100;199_2_origin.jpeg
Volné směry;35;35;1938-00-00 1940-00-00;200;200;1;S. V. U. Mánes J. Bauch: Leptané sklo v hale obytného domu Zemské banky v Praze XIX. Foto archiv Volných Směrů;0.62;131;223;2135;2935;200_1_origin.jpeg
Volné směry;35;35;1938-00-00 1940-00-00;201;201;1;5. V. U. Mánes Foto archiv Volných Směrů B. Stefan : Matka s dítětem. Socha z haly obytného domu Zemské banky v Praze XiX.;0.51;442;268;2092;2959;201_1_origin.jpeg
Volné směry;35;35;1938-00-00 1940-00-00;202;202;1;S. V., U. Mánes Marie Kulhánková-Wagnerová: Podobizna. Pálená hlína Foto archiv Volných Směrů;0.6;232;326;2185;2985;202_1_origin.jpeg
Volné směry;35;35;1938-00-00 1940-00-00;203;203;1;S.V.U. Mánes Jan Slavíček : Rak Foto archiv Volných Směrů;0.61;314;323;2247;3090;203_1_origin.jpeg
Volné směry;35;35;1938-00-00 1940-00-00;204;204;1;S$.V. U. Mánes F. Tichý: Clown Foto archiv Volných Směrů;0.46;448;341;1969;2988;204_1_origin.jpeg
Volné směry;35;35;1938-00-00 1940-00-00;205;205;1;S. V. U. Mánes Václav Špála: Ležící žena Foto archiv Volných Směrů;0.45;427;435;1910;3048;205_1_origin.jpeg
Volné směry;35;35;1938-00-00 1940-00-00;206;206;1;"S.V.U. Mánes Václav Špála:; Pole v červenci Foto archiv Volných Směrů";0.59;177;433;2175;2993;206_1_origin.jpeg
Volné směry;35;35;1938-00-00 1940-00-00;207;207;1;"$.V. U. Mánes Břetislav Benda:; Lidé bez domova. Bronz Foto archiv Volných Směrů";0.49;451;285;2056;2944;207_1_origin.jpeg
Volné směry;35;35;1938-00-00 1940-00-00;208;208;1;5. V. U, Mánes Břetislav Benda: Klečící. Bronz Foto archiv Volných Směrů;0.54;236;473;2159;2909;208_1_origin.jpeg
Volné směry;35;35;1938-00-00 1940-00-00;209;209;1;1 4;0.52;388;585;2289;2971;209_1_origin.jpeg
